{
  "/home/vssz/UTEC/Proyectos/taller-serverless/order-service/serverless.yml": {
    "versionFramework": "4.31.2",
    "servicePath": "/home/vssz/UTEC/Proyectos/taller-serverless/order-service/serverless.yml",
    "serviceConfigFileName": "serverless.yml",
    "service": {
      "service": "burger-order",
      "frameworkVersion": "4",
      "provider": {
        "name": "aws",
        "runtime": "python3.10",
        "region": "us-east-1",
        "stage": "dev",
        "memorySize": 256,
        "timeout": 20,
        "environment": {
          "TABLE_ORDERS": "${env:TABLE_PEDIDOS}",
          "TABLE_USERS": "${env:TABLE_USUARIOS}",
          "TABLE_PRODUCTS": "${env:TABLE_PRODUCTOS}",
          "TABLE_HISTORIAL_ESTADOS": "${env:TABLE_HISTORIAL_ESTADOS}",
          "STATE_MACHINE_ARN": "${env:STATE_MACHINE_ARN}",
          "VALIDAR_TOKEN_LAMBDA_NAME": "<REDACTED>"
        },
        "iam": {
          "role": "arn:aws:iam::${env:AWS_ACCOUNT_ID}:role/LabRole"
        }
      },
      "custom": {
        "pythonRequirements": {
          "fileName": "../requirements.txt"
        }
      },
      "functions": {
        "createOrder": {
          "handler": "create.create_order",
          "events": [
            {
              "http": {
                "path": "pedido",
                "method": "post",
                "authorizer": {
                  "type": "TOKEN",
                  "arn": "arn:aws:lambda:${aws:region}:${aws:accountId}:function:burger-auth-${sls:stage}-auth"
                },
                "cors": {
                  "origin": "*",
                  "headers": [
                    "Content-Type",
                    "Authorization",
                    "X-Amz-Date",
                    "X-Api-Key",
                    "X-Amz-Security-Token"
                  ],
                  "allowCredentials": "<REDACTED>"
                }
              }
            }
          ]
        },
        "listMyOrders": {
          "handler": "handlers/list_my_orders.handler",
          "events": [
            {
              "http": {
                "path": "pedidos/mis-pedidos",
                "method": "get",
                "authorizer": {
                  "type": "TOKEN",
                  "arn": "arn:aws:lambda:${aws:region}:${aws:accountId}:function:burger-auth-${sls:stage}-auth"
                },
                "cors": {
                  "origin": "*",
                  "headers": [
                    "Content-Type",
                    "Authorization",
                    "X-Amz-Date",
                    "X-Api-Key",
                    "X-Amz-Security-Token"
                  ],
                  "allowCredentials": "<REDACTED>"
                }
              }
            }
          ]
        },
        "listAllOrders": {
          "handler": "handlers/list_all_orders.handler",
          "events": [
            {
              "http": {
                "path": "pedidos/todos",
                "method": "get",
                "authorizer": {
                  "type": "TOKEN",
                  "arn": "arn:aws:lambda:${aws:region}:${aws:accountId}:function:burger-auth-${sls:stage}-auth"
                },
                "cors": {
                  "origin": "*",
                  "headers": [
                    "Content-Type",
                    "Authorization",
                    "X-Amz-Date",
                    "X-Api-Key",
                    "X-Amz-Security-Token"
                  ],
                  "allowCredentials": "<REDACTED>"
                }
              }
            }
          ]
        },
        "checkStatus": {
          "handler": "handlers/get_status.handler",
          "events": [
            {
              "http": {
                "path": "pedido/status",
                "method": "get",
                "cors": {
                  "origin": "*",
                  "headers": [
                    "Content-Type",
                    "Authorization",
                    "X-Amz-Date",
                    "X-Api-Key",
                    "X-Amz-Security-Token"
                  ],
                  "allowCredentials": "<REDACTED>"
                }
              }
            }
          ]
        },
        "orderHistory": {
          "handler": "handlers/list_my_orders.handler",
          "events": [
            {
              "http": {
                "path": "pedido/historial",
                "method": "get",
                "authorizer": {
                  "type": "TOKEN",
                  "arn": "arn:aws:lambda:${aws:region}:${aws:accountId}:function:burger-auth-${sls:stage}-auth"
                },
                "cors": {
                  "origin": "*",
                  "headers": [
                    "Content-Type",
                    "Authorization",
                    "X-Amz-Date",
                    "X-Api-Key",
                    "X-Amz-Security-Token"
                  ],
                  "allowCredentials": "<REDACTED>"
                }
              }
            }
          ]
        }
      },
      "resources": {
        "Resources": {
          "GatewayResponseUnauthorized": {
            "Type": "AWS::ApiGateway::GatewayResponse",
            "Properties": {
              "ResponseParameters": {
                "gatewayresponse.header.Access-Control-Allow-Origin": "'*'",
                "gatewayresponse.header.Access-Control-Allow-Headers": "'Content-Type,Authorization,X-Amz-Date,X-Api-Key,X-Amz-Security-Token'",
                "gatewayresponse.header.Access-Control-Allow-Methods": "'GET,POST,PUT,DELETE,OPTIONS'"
              },
              "ResponseType": "UNAUTHORIZED",
              "RestApiId": {
                "Ref": "ApiGatewayRestApi"
              },
              "StatusCode": "401"
            }
          },
          "GatewayResponseAccessDenied": {
            "Type": "AWS::ApiGateway::GatewayResponse",
            "Properties": {
              "ResponseParameters": {
                "gatewayresponse.header.Access-Control-Allow-Origin": "'*'",
                "gatewayresponse.header.Access-Control-Allow-Headers": "'Content-Type,Authorization,X-Amz-Date,X-Api-Key,X-Amz-Security-Token'",
                "gatewayresponse.header.Access-Control-Allow-Methods": "'GET,POST,PUT,DELETE,OPTIONS'"
              },
              "ResponseType": "ACCESS_DENIED",
              "RestApiId": {
                "Ref": "ApiGatewayRestApi"
              },
              "StatusCode": "403"
            }
          }
        }
      }
    },
    "provider": {
      "name": "aws",
      "runtime": "python3.10",
      "region": "us-east-1",
      "stage": "dev",
      "memorySize": 256,
      "timeout": 20,
      "environment": {
        "TABLE_ORDERS": "${env:TABLE_PEDIDOS}",
        "TABLE_USERS": "${env:TABLE_USUARIOS}",
        "TABLE_PRODUCTS": "${env:TABLE_PRODUCTOS}",
        "TABLE_HISTORIAL_ESTADOS": "${env:TABLE_HISTORIAL_ESTADOS}",
        "STATE_MACHINE_ARN": "${env:STATE_MACHINE_ARN}",
        "VALIDAR_TOKEN_LAMBDA_NAME": "<REDACTED>"
      },
      "iam": {
        "role": "arn:aws:iam::${env:AWS_ACCOUNT_ID}:role/LabRole"
      }
    },
    "error": {
      "message": "You must sign in or use a license key with Serverless Framework V.4 and later versions. Please use \"serverless login\".",
      "stack": "Error: You must sign in or use a license key with Serverless Framework V.4 and later versions. Please use \"serverless login\".\n    at Authentication.getAuthenticatedData (file:///home/vssz/.serverless/releases/4.31.2/package/dist/sf-core.js:919:11570)\n    at process.processTicksAndRejections (node:internal/process/task_queues:95:5)\n    at async Authentication.authenticate (file:///home/vssz/.serverless/releases/4.31.2/package/dist/sf-core.js:922:4140)\n    at async TraditionalRunner.resolveVariablesAndAuthenticate (file:///home/vssz/.serverless/releases/4.31.2/package/dist/sf-core.js:930:2394)\n    at async TraditionalRunner.run (file:///home/vssz/.serverless/releases/4.31.2/package/dist/sf-core.js:1953:27828)\n    at async route (file:///home/vssz/.serverless/releases/4.31.2/package/dist/sf-core.js:2167:2848)\n    at async Object.run (file:///home/vssz/.serverless/releases/4.31.2/package/dist/sf-core.js:2168:3893)\n    at async run2 (file:///home/vssz/.serverless/releases/4.31.2/package/dist/sf-core.js:2168:5047)"
    },
    "serviceRawFile": "service: burger-order\n\nframeworkVersion: '4'\n\nprovider:\n  name: aws\n  runtime: python3.10\n  region: us-east-1\n  stage: ${opt:stage, 'dev'}\n  memorySize: 256\n  timeout: 20\n  environment:\n    TABLE_ORDERS: ${env:TABLE_PEDIDOS}\n    TABLE_USERS: ${env:TABLE_USUARIOS}\n    TABLE_PRODUCTS: ${env:TABLE_PRODUCTOS}\n    TABLE_HISTORIAL_ESTADOS: ${env:TABLE_HISTORIAL_ESTADOS}\n    STATE_MACHINE_ARN: ${env:STATE_MACHINE_ARN}\n    VALIDAR_TOKEN_LAMBDA_NAME: burger-auth-${sls:stage}-auth\n  iam:\n    role: arn:aws:iam::${env:AWS_ACCOUNT_ID}:role/LabRole\n\n\ncustom:\n  pythonRequirements:\n    fileName: ../requirements.txt\n\nfunctions:\n  createOrder:\n    handler: create.create_order\n    events:\n      - http:\n          path: pedido\n          method: post\n          authorizer: \n             type: TOKEN\n             arn: arn:aws:lambda:${aws:region}:${aws:accountId}:function:burger-auth-${sls:stage}-auth\n          cors:\n            origin: '*'\n            headers:\n              - Content-Type\n              - Authorization\n              - X-Amz-Date\n              - X-Api-Key\n              - X-Amz-Security-Token\n            allowCredentials: false\n\n  listMyOrders:\n    handler: handlers/list_my_orders.handler\n    events:\n      - http:\n          path: pedidos/mis-pedidos\n          method: get\n          authorizer: \n             type: TOKEN\n             arn: arn:aws:lambda:${aws:region}:${aws:accountId}:function:burger-auth-${sls:stage}-auth\n          cors:\n            origin: '*'\n            headers:\n              - Content-Type\n              - Authorization\n              - X-Amz-Date\n              - X-Api-Key\n              - X-Amz-Security-Token\n            allowCredentials: false\n\n  listAllOrders:\n    handler: handlers/list_all_orders.handler\n    events:\n      - http:\n          path: pedidos/todos\n          method: get\n          authorizer: \n             type: TOKEN\n             arn: arn:aws:lambda:${aws:region}:${aws:accountId}:function:burger-auth-${sls:stage}-auth\n          cors:\n            origin: '*'\n            headers:\n              - Content-Type\n              - Authorization\n              - X-Amz-Date\n              - X-Api-Key\n              - X-Amz-Security-Token\n            allowCredentials: false\n\n  checkStatus:\n    handler: handlers/get_status.handler\n    events:\n      - http:\n          path: pedido/status\n          method: get\n          cors:\n            origin: '*'\n            headers:\n              - Content-Type\n              - Authorization\n              - X-Amz-Date\n              - X-Api-Key\n              - X-Amz-Security-Token\n            allowCredentials: false\n\n  orderHistory:\n    handler: handlers/list_my_orders.handler # Reusing listMyOrders as per requirement\n    events:\n      - http:\n          path: pedido/historial\n          method: get\n          authorizer: \n             type: TOKEN\n             arn: arn:aws:lambda:${aws:region}:${aws:accountId}:function:burger-auth-${sls:stage}-auth\n          cors:\n            origin: '*'\n            headers:\n              - Content-Type\n              - Authorization\n              - X-Amz-Date\n              - X-Api-Key\n              - X-Amz-Security-Token\n            allowCredentials: false\n\nresources:\n  Resources:\n    # Add Gateway Response for Unauthorized errors to include CORS headers\n    GatewayResponseUnauthorized:\n      Type: 'AWS::ApiGateway::GatewayResponse'\n      Properties:\n        ResponseParameters:\n          gatewayresponse.header.Access-Control-Allow-Origin: \"'*'\"\n          gatewayresponse.header.Access-Control-Allow-Headers: \"'Content-Type,Authorization,X-Amz-Date,X-Api-Key,X-Amz-Security-Token'\"\n          gatewayresponse.header.Access-Control-Allow-Methods: \"'GET,POST,PUT,DELETE,OPTIONS'\"\n        ResponseType: UNAUTHORIZED\n        RestApiId:\n          Ref: 'ApiGatewayRestApi'\n        StatusCode: '401'\n    \n    # Add Gateway Response for Access Denied errors to include CORS headers\n    GatewayResponseAccessDenied:\n      Type: 'AWS::ApiGateway::GatewayResponse'\n      Properties:\n        ResponseParameters:\n          gatewayresponse.header.Access-Control-Allow-Origin: \"'*'\"\n          gatewayresponse.header.Access-Control-Allow-Headers: \"'Content-Type,Authorization,X-Amz-Date,X-Api-Key,X-Amz-Security-Token'\"\n          gatewayresponse.header.Access-Control-Allow-Methods: \"'GET,POST,PUT,DELETE,OPTIONS'\"\n        ResponseType: ACCESS_DENIED\n        RestApiId:\n          Ref: 'ApiGatewayRestApi'\n        StatusCode: '403'\n",
    "command": [
      "deploy"
    ],
    "options": {
      "verbose": true
    },
    "serviceProviderAwsCfStackId": null,
    "serviceProviderAwsCfStackCreated": null,
    "serviceProviderAwsCfStackUpdated": null,
    "serviceProviderAwsCfStackStatus": null,
    "serviceProviderAwsCfStackOutputs": null
  }
}